{
  "schemaVersion": 1,
  "domain": "research",
  "generatedAt": "2026-08-07T18:42:23.799Z",
  "ok": true,
  "reason": null,
  "sources": [
    {
      "id": "toolsenabled-machine-b-status-2026-08-01",
      "kind": "desktop-report",
      "path": "TOOLSENABLED-MACHINE-B-STATUS-REPORT-2026-08-01.md",
      "ok": true,
      "observedAt": "2026-08-01T19:28:53.796Z",
      "reason": null
    },
    {
      "id": "toolsenabled-coordinator-audit-2026-08-04",
      "kind": "desktop-report",
      "path": "ToolsEnabled-COORDINATOR-AUDIT-2026-08-04.md",
      "ok": true,
      "observedAt": "2026-08-04T22:45:31.868Z",
      "reason": null
    },
    {
      "id": "toolsenabled-full-audit-2026-08-03",
      "kind": "desktop-report",
      "path": "ToolsEnabled-FULL-AUDIT-2026-08-03.md",
      "ok": true,
      "observedAt": "2026-08-04T05:32:00.043Z",
      "reason": null
    },
    {
      "id": "toolsenabled-issues-report-2026-08-04",
      "kind": "desktop-report",
      "path": "ToolsEnabled-Issues-Report-2026-08-04.md",
      "ok": true,
      "observedAt": "2026-08-04T22:33:42.096Z",
      "reason": null
    },
    {
      "id": "toolsenabled-plan-audit-2026-08-04",
      "kind": "desktop-report",
      "path": "ToolsEnabled-PLAN-AUDIT-2026-08-04.md",
      "ok": true,
      "observedAt": "2026-08-05T00:54:14.510Z",
      "reason": null
    },
    {
      "id": "toolsenabled-report-corpus-research-audit-2026-08-06",
      "kind": "desktop-report",
      "path": "ToolsEnabled-Report-Corpus-Research-Audit-2026-08-06.md",
      "ok": true,
      "observedAt": "2026-08-06T17:28:10.368Z",
      "reason": null
    },
    {
      "id": "mission-control-handoff-2026-08-07",
      "kind": "desktop-report",
      "path": "HANDOFF.md",
      "ok": true,
      "observedAt": "2026-08-07T07:36:57.724Z",
      "reason": null
    },
    {
      "id": "ai-research-initiatives-full-corpus-audit-2026-08-06",
      "kind": "desktop-report-metadata",
      "path": "currentWork86/AI-Research-Initiatives-Full-Corpus-Audit-2026-08-06.md",
      "ok": true,
      "observedAt": "2026-08-07T02:24:16.339Z",
      "reason": null
    },
    {
      "id": "llmbenchmarking-current-iteration-report",
      "kind": "desktop-report-metadata",
      "path": "currentWork86/LLMBenchmarking-current-iteration-report.md",
      "ok": true,
      "observedAt": "2026-08-06T15:59:53.046Z",
      "reason": null
    },
    {
      "id": "cerberus-research-extension-report",
      "kind": "desktop-report-metadata",
      "path": "currentWork86/Cerberus-research-extension-report.md",
      "ok": true,
      "observedAt": "2026-08-06T16:44:02.223Z",
      "reason": null
    },
    {
      "id": "lean-bench-audit-markdown",
      "kind": "desktop-report-metadata",
      "path": "LEAN-BENCH-AUDIT.md",
      "ok": true,
      "observedAt": "2026-07-29T01:13:02.207Z",
      "reason": null
    },
    {
      "id": "lean-bench-audit-html",
      "kind": "desktop-report-metadata",
      "path": "LEAN-BENCH-AUDIT.html",
      "ok": true,
      "observedAt": "2026-07-29T01:13:29.813Z",
      "reason": null
    },
    {
      "id": "lean-bench-audit-pdf",
      "kind": "desktop-report-metadata",
      "path": "LEAN-BENCH-AUDIT.pdf",
      "ok": true,
      "observedAt": "2026-07-29T01:13:37.547Z",
      "reason": null
    },
    {
      "id": "toolsenabled-current-iteration-report",
      "kind": "desktop-report-metadata",
      "path": "currentWork86/ToolsEnabled-current-iteration-report.md",
      "ok": true,
      "observedAt": "2026-08-06T14:29:45.375Z",
      "reason": null
    }
  ],
  "data": {
    "ownerScope": "local-owner",
    "findingsRegister": {
      "ok": true,
      "reason": null,
      "observedAt": null,
      "value": []
    },
    "failureTaxonomy": {
      "ok": false,
      "reason": "source-out-of-scope",
      "observedAt": null,
      "value": null
    },
    "corpusCatalog": {
      "ok": true,
      "reason": null,
      "observedAt": null,
      "value": [
        {
          "id": "toolsenabled-machine-b-status-2026-08-01",
          "title": "ToolsEnabled on Machine B — Current State and Completion Report",
          "path": "C:/Users/joshp/Desktop/TOOLSENABLED-MACHINE-B-STATUS-REPORT-2026-08-01.md",
          "bytes": 38257,
          "dateObserved": "2026-08-01T19:28:53.796Z",
          "summary": "A point-in-time operational assessment of ToolsEnabled on Machine B covering the broker, JARVIS, fleet, dashboard, bridge, scheduler, audit, and owner-request surfaces. It distinguishes live observations from historical audit claims and identifies integration and truthful-operations risks.",
          "ownerScope": "local-owner",
          "source": "desktop-report"
        },
        {
          "id": "toolsenabled-coordinator-audit-2026-08-04",
          "title": "Coordinator Audit — 2026-08-04",
          "path": "C:/Users/joshp/Desktop/ToolsEnabled-COORDINATOR-AUDIT-2026-08-04.md",
          "bytes": 8841,
          "dateObserved": "2026-08-04T22:45:31.868Z",
          "summary": "An audit of post-council coordinator behavior and system artifacts that groups recurring failures into foundational design problems. It emphasizes mechanical authority, three-state observability, actuated monitoring, closure evidence, and enforcement at chokepoints.",
          "ownerScope": "local-owner",
          "source": "desktop-report"
        },
        {
          "id": "toolsenabled-full-audit-2026-08-03",
          "title": "ToolsEnabled — Full System Audit",
          "path": "C:/Users/joshp/Desktop/ToolsEnabled-FULL-AUDIT-2026-08-03.md",
          "bytes": 210999,
          "dateObserved": "2026-08-04T05:32:00.043Z",
          "summary": "A full-system audit focused on architecture and onboarding, with a verified ranked findings set and candidate improvements. Its executive summary highlights repeated false-health patterns across live system surfaces.",
          "ownerScope": "local-owner",
          "source": "desktop-report"
        },
        {
          "id": "toolsenabled-issues-report-2026-08-04",
          "title": "ToolsEnabled — what went wrong, and what I think fixes it",
          "path": "C:/Users/joshp/Desktop/ToolsEnabled-Issues-Report-2026-08-04.md",
          "bytes": 10784,
          "dateObserved": "2026-08-04T22:33:42.096Z",
          "summary": "A coordinator-authored account of failures caused by per-tree state divergence and checks that confuse lack of visibility with failure. It proposes structural fixes for canonical-path identity and uncertainty-aware status reporting.",
          "ownerScope": "local-owner",
          "source": "desktop-report"
        },
        {
          "id": "toolsenabled-plan-audit-2026-08-04",
          "title": "ToolsEnabled Stabilization Plan — independent audit",
          "path": "C:/Users/joshp/Desktop/ToolsEnabled-PLAN-AUDIT-2026-08-04.md",
          "bytes": 19159,
          "dateObserved": "2026-08-05T00:54:14.510Z",
          "summary": "An independent review of the cross-machine stabilization plan using multiple audit lenses. It concludes the diagnosis is largely sound but documents ordering, data-loss, verification, and executability defects that must be resolved before running the plan.",
          "ownerScope": "local-owner",
          "source": "desktop-report"
        },
        {
          "id": "toolsenabled-report-corpus-research-audit-2026-08-06",
          "title": "ToolsEnabled report-corpus audit and academic research roadmap",
          "path": "C:/Users/joshp/Desktop/ToolsEnabled-Report-Corpus-Research-Audit-2026-08-06.md",
          "bytes": 66816,
          "dateObserved": "2026-08-06T17:28:10.368Z",
          "summary": "A research audit of the ToolsEnabled report corpus and a roadmap for defensible studies. It identifies provenance, benchmark-validity, liveness, governance, and estimator-correction opportunities while stating the corpus limits.",
          "ownerScope": "local-owner",
          "source": "desktop-report"
        },
        {
          "id": "mission-control-handoff-2026-08-07",
          "title": "HANDOFF — ToolsEnabled / Mission Control",
          "path": "C:/Users/joshp/Desktop/HANDOFF.md",
          "bytes": 5298,
          "dateObserved": "2026-08-07T07:36:57.724Z",
          "summary": "A transfer document mapping the canonical, retired, and Mission Control trees and recording the highest-priority runtime handoff. It documents that Mission Bridge execution requires an interactive logged-in session and includes the observed proof point for that fix.",
          "ownerScope": "local-owner",
          "source": "desktop-report"
        },
        {
          "id": "ai-research-initiatives-full-corpus-audit-2026-08-06",
          "title": "AI Research Initiatives Full Corpus Audit — 2026-08-06",
          "path": "C:/Users/joshp/Desktop/currentWork86/AI-Research-Initiatives-Full-Corpus-Audit-2026-08-06.md",
          "bytes": 507101,
          "dateObserved": "2026-08-07T02:24:16.339Z",
          "ownerScope": "local-owner",
          "source": "desktop-report",
          "needsOwnerAuthorization": true,
          "authorizationReason": "The report is identified as LLMBenchmarking/LEAN-Bench-derived or -about; R198 requires explicit owner authorization before content use."
        },
        {
          "id": "llmbenchmarking-current-iteration-report",
          "title": "LLMBenchmarking current iteration report",
          "path": "C:/Users/joshp/Desktop/currentWork86/LLMBenchmarking-current-iteration-report.md",
          "bytes": 46133,
          "dateObserved": "2026-08-06T15:59:53.046Z",
          "ownerScope": "local-owner",
          "source": "desktop-report",
          "needsOwnerAuthorization": true,
          "authorizationReason": "The report is identified as LLMBenchmarking/LEAN-Bench-derived or -about; R198 requires explicit owner authorization before content use."
        },
        {